{
  "schema_version": "1.0.0",
  "software_version": "1.4.0",
  "build_commit": "2c38a09",
  "scenarios": [
    {
      "scenario": "cold_start_warmup_and_ramp_high_temp_shutdown",
      "requirement_id": "REQ-ENG-SCRIPT-001",
      "ticks": [
        {
          "tick": 0,
          "rpm": 0.0,
          "temp": 25.0,
          "oil": 3.0,
          "run": 0,
          "result": "OK",
          "control": 0.0,
          "engine_mode": "INIT"
        },
        {
          "tick": 1,
          "rpm": 800.0,
          "temp": 44.0,
          "oil": 3.8,
          "run": 1,
          "result": "OK",
          "control": 31.25,
          "engine_mode": "STARTING"
        },
        {
          "tick": 2,
          "rpm": 1100.0,
          "temp": 49.0,
          "oil": 3.7,
          "run": 1,
          "result": "OK",
          "control": 32.0,
          "engine_mode": "RUNNING"
        },
        {
          "tick": 3,
          "rpm": 1400.0,
          "temp": 54.0,
          "oil": 3.7,
          "run": 1,
          "result": "OK",
          "control": 33.75,
          "engine_mode": "RUNNING"
        },
        {
          "tick": 4,
          "rpm": 1700.0,
          "temp": 58.5,
          "oil": 3.6,
          "run": 1,
          "result": "OK",
          "control": 34.62,
          "engine_mode": "RUNNING"
        },
        {
          "tick": 5,
          "rpm": 2000.0,
          "temp": 62.0,
          "oil": 3.5,
          "run": 1,
          "result": "OK",
          "control": 35.75,
          "engine_mode": "RUNNING"
        },
        {
          "tick": 6,
          "rpm": 2200.0,
          "temp": 65.5,
          "oil": 3.4,
          "run": 1,
          "result": "OK",
          "control": 35.88,
          "engine_mode": "RUNNING"
        },
        {
          "tick": 7,
          "rpm": 2400.0,
          "temp": 68.0,
          "oil": 3.4,
          "run": 1,
          "result": "OK",
          "control": 37.25,
          "engine_mode": "RUNNING"
        },
        {
          "tick": 8,
          "rpm": 2600.0,
          "temp": 70.5,
          "oil": 3.3,
          "run": 1,
          "result": "OK",
          "control": 37.62,
          "engine_mode": "RUNNING"
        },
        {
          "tick": 9,
          "rpm": 2800.0,
          "temp": 73.0,
          "oil": 3.2,
          "run": 1,
          "result": "OK",
          "control": 38.0,
          "engine_mode": "RUNNING"
        },
        {
          "tick": 10,
          "rpm": 3000.0,
          "temp": 75.0,
          "oil": 3.2,
          "run": 1,
          "result": "OK",
          "control": 39.5,
          "engine_mode": "RUNNING"
        },
        {
          "tick": 11,
          "rpm": 3100.0,
          "temp": 77.0,
          "oil": 3.1,
          "run": 1,
          "result": "OK",
          "control": 39.0,
          "engine_mode": "RUNNING"
        },
        {
          "tick": 12,
          "rpm": 3200.0,
          "temp": 78.5,
          "oil": 3.1,
          "run": 1,
          "result": "OK",
          "control": 39.62,
          "engine_mode": "RUNNING"
        },
        {
          "tick": 13,
          "rpm": 3300.0,
          "temp": 80.0,
          "oil": 3.0,
          "run": 1,
          "result": "OK",
          "control": 39.25,
          "engine_mode": "RUNNING"
        },
        {
          "tick": 14,
          "rpm": 3400.0,
          "temp": 90.0,
          "oil": 3.0,
          "run": 1,
          "result": "OK",
          "control": 37.75,
          "engine_mode": "RUNNING"
        },
        {
          "tick": 15,
          "rpm": 3400.0,
          "temp": 92.0,
          "oil": 3.0,
          "run": 1,
          "result": "OK",
          "control": 37.25,
          "engine_mode": "RUNNING"
        },
        {
          "tick": 16,
          "rpm": 3400.0,
          "temp": 92.5,
          "oil": 3.0,
          "run": 1,
          "result": "OK",
          "control": 37.12,
          "engine_mode": "RUNNING"
        },
        {
          "tick": 17,
          "rpm": 3400.0,
          "temp": 97.0,
          "oil": 3.0,
          "run": 1,
          "result": "OK",
          "control": 36.0,
          "engine_mode": "RUNNING"
        },
        {
          "tick": 18,
          "rpm": 3300.0,
          "temp": 98.0,
          "oil": 3.0,
          "run": 1,
          "result": "OK",
          "control": 34.75,
          "engine_mode": "RUNNING"
        },
        {
          "tick": 19,
          "rpm": 3100.0,
          "temp": 96.0,
          "oil": 3.0,
          "run": 1,
          "result": "WARNING",
          "control": 33.25,
          "engine_mode": "WARNING"
        },
        {
          "tick": 20,
          "rpm": 2900.0,
          "temp": 96.5,
          "oil": 3.1,
          "run": 1,
          "result": "SHUTDOWN",
          "control": 32.12,
          "engine_mode": "SHUTDOWN"
        },
        {
          "tick": 21,
          "rpm": 2700.0,
          "temp": 95.0,
          "oil": 3.1,
          "run": 1,
          "result": "SHUTDOWN",
          "control": 30.5,
          "engine_mode": "SHUTDOWN"
        },
        {
          "tick": 22,
          "rpm": 2400.0,
          "temp": 94.5,
          "oil": 3.2,
          "run": 1,
          "result": "SHUTDOWN",
          "control": 28.62,
          "engine_mode": "SHUTDOWN"
        },
        {
          "tick": 23,
          "rpm": 2100.0,
          "temp": 90.0,
          "oil": 3.3,
          "run": 1,
          "result": "SHUTDOWN",
          "control": 27.75,
          "engine_mode": "SHUTDOWN"
        },
        {
          "tick": 24,
          "rpm": 1700.0,
          "temp": 90.5,
          "oil": 3.4,
          "run": 1,
          "result": "SHUTDOWN",
          "control": 24.62,
          "engine_mode": "SHUTDOWN"
        },
        {
          "tick": 25,
          "rpm": 1300.0,
          "temp": 90.0,
          "oil": 3.5,
          "run": 1,
          "result": "SHUTDOWN",
          "control": 21.75,
          "engine_mode": "SHUTDOWN"
        },
        {
          "tick": 26,
          "rpm": 1250.0,
          "temp": 90.0,
          "oil": 3.4,
          "run": 1,
          "result": "SHUTDOWN",
          "control": 20.25,
          "engine_mode": "SHUTDOWN"
        },
        {
          "tick": 27,
          "rpm": 1200.0,
          "temp": 90.0,
          "oil": 3.4,
          "run": 1,
          "result": "SHUTDOWN",
          "control": 19.75,
          "engine_mode": "SHUTDOWN"
        },
        {
          "tick": 28,
          "rpm": 1100.0,
          "temp": 58.0,
          "oil": 3.5,
          "run": 1,
          "result": "SHUTDOWN",
          "control": 27.75,
          "engine_mode": "SHUTDOWN"
        },
        {
          "tick": 29,
          "rpm": 1000.0,
          "temp": 55.0,
          "oil": 3.6,
          "run": 1,
          "result": "SHUTDOWN",
          "control": 28.5,
          "engine_mode": "SHUTDOWN"
        },
        {
          "tick": 30,
          "rpm": 900.0,
          "temp": 52.0,
          "oil": 3.7,
          "run": 1,
          "result": "SHUTDOWN",
          "control": 29.25,
          "engine_mode": "SHUTDOWN"
        },
        {
          "tick": 31,
          "rpm": 800.0,
          "temp": 50.0,
          "oil": 3.7,
          "run": 1,
          "result": "SHUTDOWN",
          "control": 28.75,
          "engine_mode": "SHUTDOWN"
        },
        {
          "tick": 32,
          "rpm": 700.0,
          "temp": 48.0,
          "oil": 3.8,
          "run": 1,
          "result": "SHUTDOWN",
          "control": 29.25,
          "engine_mode": "SHUTDOWN"
        },
        {
          "tick": 33,
          "rpm": 600.0,
          "temp": 45.0,
          "oil": 3.8,
          "run": 1,
          "result": "SHUTDOWN",
          "control": 29.0,
          "engine_mode": "SHUTDOWN"
        },
        {
          "tick": 34,
          "rpm": 500.0,
          "temp": 43.0,
          "oil": 3.9,
          "run": 1,
          "result": "SHUTDOWN",
          "control": 29.5,
          "engine_mode": "SHUTDOWN"
        },
        {
          "tick": 35,
          "rpm": 400.0,
          "temp": 41.0,
          "oil": 3.9,
          "run": 1,
          "result": "SHUTDOWN",
          "control": 29.0,
          "engine_mode": "SHUTDOWN"
        },
        {
          "tick": 36,
          "rpm": 300.0,
          "temp": 39.0,
          "oil": 4.0,
          "run": 1,
          "result": "SHUTDOWN",
          "control": 29.5,
          "engine_mode": "SHUTDOWN"
        },
        {
          "tick": 37,
          "rpm": 200.0,
          "temp": 37.0,
          "oil": 4.0,
          "run": 1,
          "result": "SHUTDOWN",
          "control": 29.0,
          "engine_mode": "SHUTDOWN"
        },
        {
          "tick": 38,
          "rpm": 100.0,
          "temp": 35.0,
          "oil": 4.1,
          "run": 1,
          "result": "SHUTDOWN",
          "control": 29.5,
          "engine_mode": "SHUTDOWN"
        },
        {
          "tick": 39,
          "rpm": 0.0,
          "temp": 33.0,
          "oil": 4.1,
          "run": 1,
          "result": "SHUTDOWN",
          "control": 29.0,
          "engine_mode": "SHUTDOWN"
        }
      ],
      "expected": "SHUTDOWN",
      "actual": "SHUTDOWN",
      "pass": true
    },
    {
      "scenario": "combined_warning_persistence",
      "requirement_id": "REQ-ENG-SCRIPT-001",
      "ticks": [
        {
          "tick": 0,
          "rpm": 0.0,
          "temp": 25.0,
          "oil": 3.0,
          "run": 0,
          "result": "OK",
          "control": 0.0,
          "engine_mode": "INIT"
        },
        {
          "tick": 1,
          "rpm": 3600.0,
          "temp": 86.0,
          "oil": 3.0,
          "run": 1,
          "result": "OK",
          "control": 40.75,
          "engine_mode": "STARTING"
        },
        {
          "tick": 2,
          "rpm": 3600.0,
          "temp": 87.0,